{
  "address": "0xCf7Ed3AccA5a467e9e704C703E8D87F634fB0Fc9",
  "abi": [
    {
      "inputs": [
        {
          "internalType": "bytes32[]",
          "name": "hashes",
          "type": "bytes32[]"
        }
      ],
      "name": "calculateRootFromPowerOfTwo",
      "outputs": [
        {
          "internalType": "bytes32",
          "name": "",
          "type": "bytes32"
        }
      ],
      "stateMutability": "pure",
      "type": "function"
    },
    {
      "inputs": [
        {
          "internalType": "uint256",
          "name": "_index",
          "type": "uint256"
        }
      ],
      "name": "getEmptyTreeHashAtIndex",
      "outputs": [
        {
          "internalType": "bytes32",
          "name": "",
          "type": "bytes32"
        }
      ],
      "stateMutability": "pure",
      "type": "function"
    },
    {
      "inputs": [
        {
          "internalType": "bytes",
          "name": "_data",
          "type": "bytes"
        },
        {
          "internalType": "uint256",
          "name": "_wordIndex",
          "type": "uint256"
        }
      ],
      "name": "getHashOfWordAtIndex",
      "outputs": [
        {
          "internalType": "bytes32",
          "name": "",
          "type": "bytes32"
        }
      ],
      "stateMutability": "pure",
      "type": "function"
    },
    {
      "inputs": [
        {
          "internalType": "bytes",
          "name": "_data",
          "type": "bytes"
        },
        {
          "internalType": "uint256",
          "name": "_log2Size",
          "type": "uint256"
        }
      ],
      "name": "getMerkleRootFromBytes",
      "outputs": [
        {
          "internalType": "bytes32",
          "name": "",
          "type": "bytes32"
        }
      ],
      "stateMutability": "pure",
      "type": "function"
    },
    {
      "inputs": [
        {
          "internalType": "uint256",
          "name": "_position",
          "type": "uint256"
        },
        {
          "internalType": "uint256",
          "name": "_logSizeOfReplacement",
          "type": "uint256"
        },
        {
          "internalType": "uint256",
          "name": "_logSizeOfFullDrive",
          "type": "uint256"
        },
        {
          "internalType": "bytes32",
          "name": "_replacement",
          "type": "bytes32"
        },
        {
          "internalType": "bytes32[]",
          "name": "siblings",
          "type": "bytes32[]"
        }
      ],
      "name": "getRootAfterReplacementInDrive",
      "outputs": [
        {
          "internalType": "bytes32",
          "name": "",
          "type": "bytes32"
        }
      ],
      "stateMutability": "pure",
      "type": "function"
    }
  ],
  "transactionHash": "0xe4cbd6e1b8cbef8003127d5f041b21c21a84068f49c260190b1fc21964eb35cd",
  "receipt": {
    "to": null,
    "from": "0xf39Fd6e51aad88F6F4ce6aB8827279cffFb92266",
    "contractAddress": "0xCf7Ed3AccA5a467e9e704C703E8D87F634fB0Fc9",
    "transactionIndex": 0,
    "gasUsed": "1317703",
    "logsBloom": "0x00000000000000000000000000000000000000000000000000000000000000000000000000000000000000000000000000000000000000000000000000000000000000000000000000000000000000000000000000000000000000000000000000000000000000000000000000000000000000000000000000000000000000000000000000000000000000000000000000000000000000000000000000000000000000000000000000000000000000000000000000000000000000000000000000000000000000000000000000000000000000000000000000000000000000000000000000000000000000000000000000000000000000000000000000000000",
    "blockHash": "0x858f9877a596e31258b46b9e21015991edca5f8dcd71a2eab59a569db6543798",
    "transactionHash": "0xe4cbd6e1b8cbef8003127d5f041b21c21a84068f49c260190b1fc21964eb35cd",
    "logs": [],
    "blockNumber": 4,
    "cumulativeGasUsed": "1317703",
    "status": 1,
    "byzantium": true
  },
  "args": [],
  "numDeployments": 1,
  "metadata": "{\"compiler\":{\"version\":\"0.8.4+commit.c7e474f2\"},\"language\":\"Solidity\",\"output\":{\"abi\":[{\"inputs\":[{\"internalType\":\"bytes32[]\",\"name\":\"hashes\",\"type\":\"bytes32[]\"}],\"name\":\"calculateRootFromPowerOfTwo\",\"outputs\":[{\"internalType\":\"bytes32\",\"name\":\"\",\"type\":\"bytes32\"}],\"stateMutability\":\"pure\",\"type\":\"function\"},{\"inputs\":[{\"internalType\":\"uint256\",\"name\":\"_index\",\"type\":\"uint256\"}],\"name\":\"getEmptyTreeHashAtIndex\",\"outputs\":[{\"internalType\":\"bytes32\",\"name\":\"\",\"type\":\"bytes32\"}],\"stateMutability\":\"pure\",\"type\":\"function\"},{\"inputs\":[{\"internalType\":\"bytes\",\"name\":\"_data\",\"type\":\"bytes\"},{\"internalType\":\"uint256\",\"name\":\"_wordIndex\",\"type\":\"uint256\"}],\"name\":\"getHashOfWordAtIndex\",\"outputs\":[{\"internalType\":\"bytes32\",\"name\":\"\",\"type\":\"bytes32\"}],\"stateMutability\":\"pure\",\"type\":\"function\"},{\"inputs\":[{\"internalType\":\"bytes\",\"name\":\"_data\",\"type\":\"bytes\"},{\"internalType\":\"uint256\",\"name\":\"_log2Size\",\"type\":\"uint256\"}],\"name\":\"getMerkleRootFromBytes\",\"outputs\":[{\"internalType\":\"bytes32\",\"name\":\"\",\"type\":\"bytes32\"}],\"stateMutability\":\"pure\",\"type\":\"function\"},{\"inputs\":[{\"internalType\":\"uint256\",\"name\":\"_position\",\"type\":\"uint256\"},{\"internalType\":\"uint256\",\"name\":\"_logSizeOfReplacement\",\"type\":\"uint256\"},{\"internalType\":\"uint256\",\"name\":\"_logSizeOfFullDrive\",\"type\":\"uint256\"},{\"internalType\":\"bytes32\",\"name\":\"_replacement\",\"type\":\"bytes32\"},{\"internalType\":\"bytes32[]\",\"name\":\"siblings\",\"type\":\"bytes32[]\"}],\"name\":\"getRootAfterReplacementInDrive\",\"outputs\":[{\"internalType\":\"bytes32\",\"name\":\"\",\"type\":\"bytes32\"}],\"stateMutability\":\"pure\",\"type\":\"function\"}],\"devdoc\":{\"kind\":\"dev\",\"methods\":{\"calculateRootFromPowerOfTwo(bytes32[])\":{\"params\":{\"hashes\":\"The array containing power of 2 elements\"},\"returns\":{\"_0\":\"byte32 the root hash being calculated\"}},\"getEmptyTreeHashAtIndex(uint256)\":{\"details\":\"first index is keccak(0), second index is keccak(keccak(0), keccak(0))\",\"params\":{\"_index\":\"of hash wanted\"}},\"getHashOfWordAtIndex(bytes,uint256)\":{\"details\":\"if word is incomplete (< 8 bytes) it gets padded with zeroes\",\"params\":{\"_data\":\"array of bytes\",\"_wordIndex\":\"index of word inside the bytes to get the hash of\"}},\"getMerkleRootFromBytes(bytes,uint256)\":{\"details\":\"_data is padded with zeroes until is multiple of 8root is completed with zero tree until log2size is completehashes are taken word by word (8 bytes by 8 bytes)\",\"params\":{\"_data\":\"array of bytes to be merklelized\",\"_log2Size\":\"log2 of total size of the drive\"}},\"getRootAfterReplacementInDrive(uint256,uint256,uint256,bytes32,bytes32[])\":{\"params\":{\"_logSizeOfFullDrive\":\"log2 of size the full drive, which can be the entire machine\",\"_logSizeOfReplacement\":\"log2 of size the replacement\",\"_position\":\"position of _drive\",\"_replacement\":\"hash of the replacement\",\"siblings\":\"of replacement that merkle root can be calculated\"}}},\"version\":1},\"userdoc\":{\"kind\":\"user\",\"methods\":{\"calculateRootFromPowerOfTwo(bytes32[])\":{\"notice\":\"Calculate the root of Merkle tree from an array of power of 2 elements\"},\"getEmptyTreeHashAtIndex(uint256)\":{\"notice\":\"Gets precomputed hash of zero in empty tree hashes\"},\"getHashOfWordAtIndex(bytes,uint256)\":{\"notice\":\"Get the hash of a word in an array of bytes\"},\"getMerkleRootFromBytes(bytes,uint256)\":{\"notice\":\"get merkle root of generic array of bytes\"},\"getRootAfterReplacementInDrive(uint256,uint256,uint256,bytes32,bytes32[])\":{\"notice\":\"Gets merkle root hash of drive with a replacement\"}},\"version\":1}},\"settings\":{\"compilationTarget\":{\"contracts/Merkle.sol\":\"Merkle\"},\"evmVersion\":\"istanbul\",\"libraries\":{},\"metadata\":{\"bytecodeHash\":\"ipfs\",\"useLiteralContent\":true},\"optimizer\":{\"enabled\":true,\"runs\":200},\"remappings\":[]},\"sources\":{\"contracts/CartesiMath.sol\":{\"content\":\"// Copyright 2020 Cartesi Pte. Ltd.\\n\\n// SPDX-License-Identifier: Apache-2.0\\n// Licensed under the Apache License, Version 2.0 (the \\\"License\\\"); you may not use\\n// this file except in compliance with the License. You may obtain a copy of the\\n// License at http://www.apache.org/licenses/LICENSE-2.0\\n\\n// Unless required by applicable law or agreed to in writing, software distributed\\n// under the License is distributed on an \\\"AS IS\\\" BASIS, WITHOUT WARRANTIES OR\\n// CONDITIONS OF ANY KIND, either express or implied. See the License for the\\n// specific language governing permissions and limitations under the License.\\n\\n/// @title CartesiMath\\n/// @author Felipe Argento\\npragma solidity ^0.8.0;\\n\\nlibrary CartesiMath {\\n    // mapping values are packed as bytes3 each\\n    // see test/TestCartesiMath.ts for decimal values\\n    bytes constant log2tableTimes1M =\\n        hex\\\"0000000F4240182F421E8480236E082771822AD63A2DC6C0305E8532B04834C96736B3C23876D73A187A3B9D4A3D09003E5EA63FA0C540D17741F28843057D440BA745062945F60246DC1047B917488DC7495ABA4A207C4ADF8A4B98544C4B404CF8AA4DA0E64E44434EE3054F7D6D5013B750A61A5134C851BFF05247BD52CC58534DE753CC8D54486954C19C55384255AC75561E50568DE956FB575766B057D00758376F589CFA5900BA5962BC59C3135A21CA5A7EF15ADA945B34BF5B8D805BE4DF5C3AEA5C8FA95CE3265D356C5D86835DD6735E25455E73005EBFAD5F0B525F55F75F9FA25FE85A60302460770860BD0A61023061467F6189FD61CCAE620E98624FBF62902762CFD5630ECD634D12638AA963C7966403DC643F7F647A8264B4E864EEB56527EC6560906598A365D029660724663D9766738566A8F066DDDA6712476746386779AF67ACAF67DF3A6811526842FA68743268A4FC68D55C6905536934E169640A6992CF69C13169EF326A1CD46A4A186A76FF6AA38C6ACFC0\\\";\\n\\n    /// @notice Approximates log2 * 1M\\n    /// @param _num number to take log2 * 1M of\\n    /// @return approximate log2 times 1M\\n    function log2ApproxTimes1M(uint256 _num) public pure returns (uint256) {\\n        require(_num > 0, \\\"Number cannot be zero\\\");\\n        uint256 leading = 0;\\n\\n        if (_num == 1) return 0;\\n\\n        while (_num > 128) {\\n            _num = _num >> 1;\\n            leading += 1;\\n        }\\n        return (leading * uint256(1000000)) + (getLog2TableTimes1M(_num));\\n    }\\n\\n    /// @notice navigates log2tableTimes1M\\n    /// @param _num number to take log2 of\\n    /// @return result after table look-up\\n    function getLog2TableTimes1M(uint256 _num) public pure returns (uint256) {\\n        bytes3 result = 0;\\n        for (uint8 i = 0; i < 3; i++) {\\n            bytes3 tempResult = log2tableTimes1M[(_num - 1) * 3 + i];\\n            result = result | (tempResult >> (i * 8));\\n        }\\n\\n        return uint256(uint24(result));\\n    }\\n\\n    /// @notice get floor of log2 of number\\n    /// @param _num number to take floor(log2) of\\n    /// @return floor(log2) of _num\\n   function getLog2Floor(uint256 _num) public pure returns (uint8) {\\n       require(_num != 0, \\\"log of zero is undefined\\\");\\n\\n       return uint8(255 - clz(_num));\\n    }\\n\\n    /// @notice checks if a number is Power of 2\\n    /// @param _num number to check\\n    /// @return true if number is power of 2, false if not\\n    function isPowerOf2(uint256 _num) public pure returns (bool) {\\n        if (_num == 0) return false;\\n\\n        return _num & (_num - 1) == 0;\\n    }\\n\\n    /// @notice count trailing zeros\\n    /// @param _num number you want the ctz of\\n    /// @dev this a binary search implementation\\n    function ctz(uint256 _num) public pure returns (uint256) {\\n        if (_num == 0) return 256;\\n\\n        uint256 n = 0;\\n        if (_num & 0x00000000000000000000000000000000FFFFFFFFFFFFFFFFFFFFFFFFFFFFFFFF == 0) { n = n + 128; _num = _num >> 128; }\\n        if (_num & 0x000000000000000000000000000000000000000000000000FFFFFFFFFFFFFFFF == 0) { n = n + 64; _num = _num >> 64; }\\n        if (_num & 0x00000000000000000000000000000000000000000000000000000000FFFFFFFF == 0) { n = n + 32; _num = _num >> 32; }\\n        if (_num & 0x000000000000000000000000000000000000000000000000000000000000FFFF == 0) { n = n + 16; _num = _num >> 16; }\\n        if (_num & 0x00000000000000000000000000000000000000000000000000000000000000FF == 0) { n = n +  8; _num = _num >>  8; }\\n        if (_num & 0x000000000000000000000000000000000000000000000000000000000000000F == 0) { n = n +  4; _num = _num >>  4; }\\n        if (_num & 0x0000000000000000000000000000000000000000000000000000000000000003 == 0) { n = n +  2; _num = _num >>  2; }\\n        if (_num & 0x0000000000000000000000000000000000000000000000000000000000000001 == 0) { n = n +  1; }\\n\\n        return n;\\n    }\\n\\n    /// @notice count leading zeros\\n    /// @param _num number you want the clz of\\n    /// @dev this a binary search implementation\\n    function clz(uint256 _num) public pure returns (uint256) {\\n        if (_num == 0) return 256;\\n\\n        uint256 n = 0;\\n        if (_num & 0xFFFFFFFFFFFFFFFFFFFFFFFFFFFFFFFF00000000000000000000000000000000 == 0) { n = n + 128; _num = _num << 128; }\\n        if (_num & 0xFFFFFFFFFFFFFFFF000000000000000000000000000000000000000000000000 == 0) { n = n + 64; _num = _num << 64; }\\n        if (_num & 0xFFFFFFFF00000000000000000000000000000000000000000000000000000000 == 0) { n = n + 32; _num = _num << 32; }\\n        if (_num & 0xFFFF000000000000000000000000000000000000000000000000000000000000 == 0) { n = n + 16; _num = _num << 16; }\\n        if (_num & 0xFF00000000000000000000000000000000000000000000000000000000000000 == 0) { n = n +  8; _num = _num <<  8; }\\n        if (_num & 0xF000000000000000000000000000000000000000000000000000000000000000 == 0) { n = n +  4; _num = _num <<  4; }\\n        if (_num & 0xC000000000000000000000000000000000000000000000000000000000000000 == 0) { n = n +  2; _num = _num <<  2; }\\n        if (_num & 0x8000000000000000000000000000000000000000000000000000000000000000 == 0) { n = n +  1; }\\n\\n        return n;\\n    }\\n}\\n\",\"keccak256\":\"0x28b74012e966438edff701decdc5ffd207b3f0244af65fbd7d397050986e58d4\",\"license\":\"Apache-2.0\"},\"contracts/Merkle.sol\":{\"content\":\"// Copyright 2020 Cartesi Pte. Ltd.\\n\\n// SPDX-License-Identifier: Apache-2.0\\n// Licensed under the Apache License, Version 2.0 (the \\\"License\\\"); you may not use\\n// this file except in compliance with the License. You may obtain a copy of the\\n// License at http://www.apache.org/licenses/LICENSE-2.0\\n\\n// Unless required by applicable law or agreed to in writing, software distributed\\n// under the License is distributed on an \\\"AS IS\\\" BASIS, WITHOUT WARRANTIES OR\\n// CONDITIONS OF ANY KIND, either express or implied. See the License for the\\n// specific language governing permissions and limitations under the License.\\n\\n/// @title Library for Merkle proofs\\npragma solidity ^0.8.0;\\n\\nimport \\\"./CartesiMath.sol\\\";\\n\\nlibrary Merkle {\\n    using CartesiMath for uint256;\\n\\n    uint128 constant L_WORD_SIZE = 3; // word = 8 bytes, log = 3\\n    // number of hashes in EMPTY_TREE_HASHES\\n    uint128 constant EMPTY_TREE_SIZE = 1952; // 61*32=1952. 32 bytes per 61 indexes (64 words)\\n\\n    // merkle root hashes of trees of zero concatenated\\n    // 32 bytes for each root, first one is keccak(0), second one is\\n    // keccak(keccack(0), keccak(0)) and so on\\n\\n    bytes constant EMPTY_TREE_HASHES =\\n        hex\\\"011b4d03dd8c01f1049143cf9c4c817e4b167f1d1b83e5c6f0f10d89ba1e7bce4d9470a821fbe90117ec357e30bad9305732fb19ddf54a07dd3e29f440619254ae39ce8537aca75e2eff3e38c98011dfe934e700a0967732fc07b430dd656a233fc9a15f5b4869c872f81087bb6104b7d63e6f9ab47f2c43f3535eae7172aa7f17d2dd614cddaa4d879276b11e0672c9560033d3e8453a1d045339d34ba601b9c37b8b13ca95166fb7af16988a70fcc90f38bf9126fd833da710a47fb37a55e68e7a427fa943d9966b389f4f257173676090c6e95f43e2cb6d65f8758111e30930b0b9deb73e155c59740bacf14a6ff04b64bb8e201a506409c3fe381ca4ea90cd5deac729d0fdaccc441d09d7325f41586ba13c801b7eccae0f95d8f3933efed8b96e5b7f6f459e9cb6a2f41bf276c7b85c10cd4662c04cbbb365434726c0a0c9695393027fb106a8153109ac516288a88b28a93817899460d6310b71cf1e6163e8806fa0d4b197a259e8c3ac28864268159d0ac85f8581ca28fa7d2c0c03eb91e3eee5ca7a3da2b3053c9770db73599fb149f620e3facef95e947c0ee860b72122e31e4bbd2b7c783d79cc30f60c6238651da7f0726f767d22747264fdb046f7549f26cc70ed5e18baeb6c81bb0625cb95bb4019aeecd40774ee87ae29ec517a71f6ee264c5d761379b3d7d617ca83677374b49d10aec50505ac087408ca892b573c267a712a52e1d06421fe276a03efb1889f337201110fdc32a81f8e152499af665835aabfdc6740c7e2c3791a31c3cdc9f5ab962f681b12fc092816a62f27d86025599a41233848702f0cfc0437b445682df51147a632a0a083d2d38b5e13e466a8935afff58bb533b3ef5d27fba63ee6b0fd9e67ff20af9d50deee3f8bf065ec220c1fd4ba57e341261d55997f85d66d32152526736872693d2b437a233e2337b715f6ac9a6a272622fdc2d67fcfe1da3459f8dab4ed7e40a657a54c36766c5e8ac9a88b35b05c34747e6507f6b044ab66180dc76ac1a696de03189593fedc0d0dbbd855c8ead673544899b0960e4a5a7ca43b4ef90afe607de7698caefdc242788f654b57a4fb32a71b335ef6ff9a4cc118b282b53bdd6d6192b7a82c3c5126b9c7e33c8e5a5ac9738b8bd31247fb7402054f97b573e8abb9faad219f4fd085aceaa7f542d787ee4196d365f3cc566e7bbcfbfd451230c48d804c017d21e2d8fa914e2559bb72bf0ab78c8ab92f00ef0d0d576eccdd486b64138a4172674857e543d1d5b639058dd908186597e366ad5f3d9c7ceaff44d04d1550b8d33abc751df07437834ba5acb32328a396994aebb3c40f759c2d6d7a3cb5377e55d5d218ef5a296dda8ddc355f3f50c3d0b660a51dfa4d98a6a5a33564556cf83c1373a814641d6a1dcef97b883fee61bb84fe60a3409340217e629cc7e4dcc93b85d8820921ff5826148b60e6939acd7838e1d7f20562bff8ee4b5ec4a05ad997a57b9796fdcb2eda87883c2640b072b140b946bfdf6575cacc066fdae04f6951e63624cbd316a677cad529bbe4e97b9144e4bc06c4afd1de55dd3e1175f90423847a230d34dfb71ed56f2965a7f6c72e6aa33c24c303fd67745d632656c5ef90bec80f4f5d1daa251988826cef375c81c36bf457e09687056f924677cb0bccf98dff81e014ce25f2d132497923e267363963cdf4302c5049d63131dc03fd95f65d8b6aa5934f817252c028c90f56d413b9d5d10d89790707dae2fabb249f649929927c21dd71e3f656826de5451c5da375aadecbd59d5ebf3a31fae65ac1b316a1611f1b276b26530f58d7247df459ce1f86db1d734f6f811932f042cee45d0e455306d01081bc3384f82c5fb2aacaa19d89cdfa46cc916eac61121475ba2e6191b4feecbe1789717021a158ace5d06744b40f551076b67cd63af60007f8c99876e1424883a45ec49d497ddaf808a5521ca74a999ab0b3c7aa9c80f85e93977ec61ce68b20307a1a81f71ca645b568fcd319ccbb5f651e87b707d37c39e15f945ea69e2f7c7d2ccc85b7e654c07e96f0636ae4044fe0e38590b431795ad0f8647bdd613713ada493cc17efd313206380e6a685b8198475bbd021c6e9d94daab2214947127506073e44d5408ba166c512a0b86805d07f5a44d3c41706be2bc15e712e55805248b92e8677d90f6d284d1d6ffaff2c430657042a0e82624fa3717b06cc0a6fd12230ea586dae83019fb9e06034ed2803c98d554b93c9a52348cafff75c40174a91f9ae6b8647854a156029f0b88b83316663ce574a4978277bb6bb27a31085634b6ec78864b6d8201c7e93903d75815067e378289a3d072ae172dafa6a452470f8d645bebfad9779594fc0784bb764a22e3a8181d93db7bf97893c414217a618ccb14caa9e92e8c61673afc9583662e812adba1f87a9c68202d60e909efab43c42c0cb00695fc7f1ffe67c75ca894c3c51e1e5e731360199e600f6ced9a87b2a6a87e70bf251bb5075ab222138288164b2eda727515ea7de12e2496d4fe42ea8d1a120c03cf9c50622c2afe4acb0dad98fd62d07ab4e828a94495f6d1ab973982c7ccbe6c1fae02788e4422ae22282fa49cbdb04ba54a7a238c6fc41187451383460762c06d1c8a72b9cd718866ad4b689e10c9a8c38fe5ef045bd785b01e980fc82c7e3532ce81876b778dd9f1ceeba4478e86411fb6fdd790683916ca832592485093644e8760cd7b4c01dba1ccc82b661bf13f0e3f34acd6b88\\\";\\n\\n    /// @notice Gets merkle root hash of drive with a replacement\\n    /// @param _position position of _drive\\n    /// @param _logSizeOfReplacement log2 of size the replacement\\n    /// @param _logSizeOfFullDrive log2 of size the full drive, which can be the entire machine\\n    /// @param _replacement hash of the replacement\\n    /// @param siblings of replacement that merkle root can be calculated\\n    function getRootAfterReplacementInDrive(\\n        uint256 _position,\\n        uint256 _logSizeOfReplacement,\\n        uint256 _logSizeOfFullDrive,\\n        bytes32 _replacement,\\n        bytes32[] calldata siblings\\n    ) public pure returns (bytes32) {\\n        require(\\n            _logSizeOfFullDrive >= _logSizeOfReplacement &&\\n                _logSizeOfReplacement >= 3 &&\\n                _logSizeOfFullDrive <= 64,\\n            \\\"3 <= logSizeOfReplacement <= logSizeOfFullDrive <= 64\\\"\\n        );\\n\\n        uint256 size = 1 << _logSizeOfReplacement;\\n\\n        require(((size - 1) & _position) == 0, \\\"Position is not aligned\\\");\\n        require(\\n            siblings.length == _logSizeOfFullDrive - _logSizeOfReplacement,\\n            \\\"Proof length does not match\\\"\\n        );\\n\\n        for (uint256 i; i < siblings.length; i++) {\\n            if ((_position & (size << i)) == 0) {\\n                _replacement = keccak256(\\n                    abi.encodePacked(_replacement, siblings[i])\\n                );\\n            } else {\\n                _replacement = keccak256(\\n                    abi.encodePacked(siblings[i], _replacement)\\n                );\\n            }\\n        }\\n\\n        return _replacement;\\n    }\\n\\n    /// @notice Gets precomputed hash of zero in empty tree hashes\\n    /// @param _index of hash wanted\\n    /// @dev first index is keccak(0), second index is keccak(keccak(0), keccak(0))\\n    function getEmptyTreeHashAtIndex(uint256 _index)\\n        public\\n        pure\\n        returns (bytes32)\\n    {\\n        uint256 start = _index * 32;\\n        require(EMPTY_TREE_SIZE >= start + 32, \\\"index out of bounds\\\");\\n        bytes32 hashedZeros;\\n        bytes memory zeroTree = EMPTY_TREE_HASHES;\\n\\n        // first word is length, then skip index words\\n        assembly {\\n            hashedZeros := mload(add(add(zeroTree, 0x20), start))\\n        }\\n        return hashedZeros;\\n    }\\n\\n    /// @notice get merkle root of generic array of bytes\\n    /// @param _data array of bytes to be merklelized\\n    /// @param _log2Size log2 of total size of the drive\\n    /// @dev _data is padded with zeroes until is multiple of 8\\n    /// @dev root is completed with zero tree until log2size is complete\\n    /// @dev hashes are taken word by word (8 bytes by 8 bytes)\\n    function getMerkleRootFromBytes(bytes calldata _data, uint256 _log2Size)\\n        public\\n        pure\\n        returns (bytes32)\\n    {\\n        require(_log2Size >= 3 && _log2Size <= 64, \\\"range of log2Size: [3,64]\\\");\\n\\n        // if _data is empty return pristine drive of size log2size\\n        if (_data.length == 0) return getEmptyTreeHashAtIndex(_log2Size - 3);\\n\\n        // total size of the drive in words\\n        uint256 size = 1 << (_log2Size - 3);\\n        require(\\n            size << L_WORD_SIZE >= _data.length,\\n            \\\"data is bigger than drive\\\"\\n        );\\n        // the stack depth is log2(_data.length / 8) + 2\\n        uint256 stack_depth = 2 +\\n            ((_data.length) >> L_WORD_SIZE).getLog2Floor();\\n        bytes32[] memory stack = new bytes32[](stack_depth);\\n\\n        uint256 numOfHashes; // total number of hashes on stack (counting levels)\\n        uint256 stackLength; // total length of stack\\n        uint256 numOfJoins; // number of hashes of the same level on stack\\n        uint256 topStackLevel; // hash level of the top of the stack\\n\\n        while (numOfHashes < size) {\\n            if ((numOfHashes << L_WORD_SIZE) < _data.length) {\\n                // we still have words to hash\\n                stack[stackLength] = getHashOfWordAtIndex(_data, numOfHashes);\\n                numOfHashes++;\\n\\n                numOfJoins = numOfHashes;\\n            } else {\\n                // since padding happens in hashOfWordAtIndex function\\n                // we only need to complete the stack with pre-computed\\n                // hash(0), hash(hash(0),hash(0)) and so on\\n                topStackLevel = numOfHashes.ctz();\\n\\n                stack[stackLength] = getEmptyTreeHashAtIndex(topStackLevel);\\n\\n                //Empty Tree Hash summarizes many hashes\\n                numOfHashes = numOfHashes + (1 << topStackLevel);\\n                numOfJoins = numOfHashes >> topStackLevel;\\n            }\\n\\n            stackLength++;\\n\\n            // while there are joins, hash top of stack together\\n            while (numOfJoins & 1 == 0) {\\n                bytes32 h2 = stack[stackLength - 1];\\n                bytes32 h1 = stack[stackLength - 2];\\n\\n                stack[stackLength - 2] = keccak256(abi.encodePacked(h1, h2));\\n                stackLength = stackLength - 1; // remove hashes from stack\\n\\n                numOfJoins = numOfJoins >> 1;\\n            }\\n        }\\n        require(stackLength == 1, \\\"stack error\\\");\\n\\n        return stack[0];\\n    }\\n\\n    /// @notice Get the hash of a word in an array of bytes\\n    /// @param _data array of bytes\\n    /// @param _wordIndex index of word inside the bytes to get the hash of\\n    /// @dev if word is incomplete (< 8 bytes) it gets padded with zeroes\\n    function getHashOfWordAtIndex(bytes calldata _data, uint256 _wordIndex)\\n        public\\n        pure\\n        returns (bytes32)\\n    {\\n        uint256 start = _wordIndex << L_WORD_SIZE;\\n        uint256 end = start + (1 << L_WORD_SIZE);\\n\\n        // TODO: in .lua this just returns zero, but this might be more consistent\\n        require(start <= _data.length, \\\"word out of bounds\\\");\\n\\n        if (end <= _data.length) {\\n            return keccak256(abi.encodePacked(_data[start:end]));\\n        }\\n\\n        // word is incomplete\\n        // fill paddedSlice with incomplete words - the rest is going to be bytes(0)\\n        bytes memory paddedSlice = new bytes(8);\\n        uint256 remaining = _data.length - start;\\n\\n        for (uint256 i; i < remaining; i++) {\\n            paddedSlice[i] = _data[start + i];\\n        }\\n\\n        return keccak256(paddedSlice);\\n    }\\n\\n    /// @notice Calculate the root of Merkle tree from an array of power of 2 elements\\n    /// @param hashes The array containing power of 2 elements\\n    /// @return byte32 the root hash being calculated\\n    function calculateRootFromPowerOfTwo(bytes32[] memory hashes)\\n        public\\n        pure\\n        returns (bytes32)\\n    {\\n        // revert when the input is not of power of 2\\n        require((hashes.length).isPowerOf2(), \\\"array len not power of 2\\\");\\n\\n        if (hashes.length == 1) {\\n            return hashes[0];\\n        } else {\\n            bytes32[] memory newHashes = new bytes32[](hashes.length >> 1);\\n\\n            for (uint256 i; i < hashes.length; i += 2) {\\n                newHashes[i >> 1] = keccak256(\\n                    abi.encodePacked(hashes[i], hashes[i + 1])\\n                );\\n            }\\n\\n            return calculateRootFromPowerOfTwo(newHashes);\\n        }\\n    }\\n}\\n\",\"keccak256\":\"0xe9896db44cc4dab335a3e776c629186824823d316d902b2efecb4b0a3e3dfdb7\",\"license\":\"Apache-2.0\"}},\"version\":1}",
  "bytecode": "0x6116df61003a600b82828239805160001a60731461002d57634e487b7160e01b600052600060045260246000fd5b30600052607381538281f3fe73000000000000000000000000000000000000000030146080604052600436106100615760003560e01c806334bd712d14610066578063451a10551461008b57806379de46011461009e57806382b0eab8146100b1578063c84583a1146100c4575b600080fd5b610079610074366004610cbd565b6100d7565b60405190815260200160405180910390f35b610079610099366004610d30565b610245565b6100796100ac366004610d60565b6102d6565b6100796100bf366004610bdd565b610505565b6100796100d2366004610cbd565b610756565b6000600382901b816100ea600883610e4f565b9050848211156101365760405162461bcd60e51b8152602060048201526012602482015271776f7264206f7574206f6620626f756e647360701b60448201526064015b60405180910390fd5b8481116101795761014981838789610e27565b60405160200161015a929190610e17565b604051602081830303815290604052805190602001209250505061023e565b60408051600880825281830190925260009160208201818036833701905050905060006101a68488610eab565b905060005b8181101561022f5788886101bf8388610e4f565b8181106101dc57634e487b7160e01b600052603260045260246000fd5b9050013560f81c60f81b83828151811061020657634e487b7160e01b600052603260045260246000fd5b60200101906001600160f81b031916908160001a9053508061022781610ec2565b9150506101ab565b50508051602090910120925050505b9392505050565b600080610253836020610e8c565b9050610260816020610e4f565b6107a010156102a75760405162461bcd60e51b8152602060048201526013602482015272696e646578206f7574206f6620626f756e647360681b604482015260640161012d565b600080604051806107c001604052806107a08152602001610f0a6107a091399290920160200151949350505050565b60008585101580156102e9575060038610155b80156102f6575060408511155b6103605760405162461bcd60e51b815260206004820152603560248201527f33203c3d206c6f6753697a654f665265706c6163656d656e74203c3d206c6f6760448201527414da5e9953d9919d5b1b111c9a5d99480f0f480d8d605a1b606482015260840161012d565b600180871b9088906103729083610eab565b16156103c05760405162461bcd60e51b815260206004820152601760248201527f506f736974696f6e206973206e6f7420616c69676e6564000000000000000000604482015260640161012d565b6103ca8787610eab565b83146104185760405162461bcd60e51b815260206004820152601b60248201527f50726f6f66206c656e67746820646f6573206e6f74206d617463680000000000604482015260640161012d565b60005b838110156104f85781811b891661048b578585858381811061044d57634e487b7160e01b600052603260045260246000fd5b9050602002013560405160200161046e929190918252602082015260400190565b6040516020818303038152906040528051906020012095506104e6565b8484828181106104ab57634e487b7160e01b600052603260045260246000fd5b90506020020135866040516020016104cd929190918252602082015260400190565b6040516020818303038152906040528051906020012095505b806104f081610ec2565b91505061041b565b5093979650505050505050565b805160405163d82ae4b160e01b8152600091739fE46736679d2D9a65F0992F2272dE9f3c7fa6e09163d82ae4b1916105439160040190815260200190565b60206040518083038186803b15801561055b57600080fd5b505af415801561056f573d6000803e3d6000fd5b505050506040513d601f19601f820116820180604052508101906105939190610c9d565b6105df5760405162461bcd60e51b815260206004820152601860248201527f6172726179206c656e206e6f7420706f776572206f6620320000000000000000604482015260640161012d565b815160011415610619578160008151811061060a57634e487b7160e01b600052603260045260246000fd5b60200260200101519050919050565b600060018351901c67ffffffffffffffff81111561064757634e487b7160e01b600052604160045260246000fd5b604051908082528060200260200182016040528015610670578160200160208202803683370190505b50905060005b835181101561074c5783818151811061069f57634e487b7160e01b600052603260045260246000fd5b6020026020010151848260016106b59190610e4f565b815181106106d357634e487b7160e01b600052603260045260246000fd5b60200260200101516040516020016106f5929190918252602082015260400190565b6040516020818303038152906040528051906020012082600183901c8151811061072f57634e487b7160e01b600052603260045260246000fd5b6020908102919091010152610745600282610e4f565b9050610676565b5061023e81610505565b60006003821015801561076a575060408211155b6107b65760405162461bcd60e51b815260206004820152601960248201527f72616e6765206f66206c6f673253697a653a205b332c36345d00000000000000604482015260640161012d565b826107d0576107c9610099600384610eab565b905061023e565b60006107dd600384610eab565b6001901b9050600381901b8411156108375760405162461bcd60e51b815260206004820152601960248201527f6461746120697320626967676572207468616e20647269766500000000000000604482015260640161012d565b6040516306c8e54b60e01b8152600385901c6004820152600090739fE46736679d2D9a65F0992F2272dE9f3c7fa6e0906306c8e54b9060240160206040518083038186803b15801561088857600080fd5b505af415801561089c573d6000803e3d6000fd5b505050506040513d601f19601f820116820180604052508101906108c09190610df6565b6108cb906002610e67565b60ff16905060008167ffffffffffffffff8111156108f957634e487b7160e01b600052604160045260246000fd5b604051908082528060200260200182016040528015610922578160200160208202803683370190505b5090506000806000805b86841015610b6657600384901b8a111561098b5761094b8b8b866100d7565b85848151811061096b57634e487b7160e01b600052603260045260246000fd5b60209081029190910101528361098081610ec2565b945050839150610a59565b60405163052dcf5f60e31b815260048101859052739fE46736679d2D9a65F0992F2272dE9f3c7fa6e09063296e7af89060240160206040518083038186803b1580156109d657600080fd5b505af41580156109ea573d6000803e3d6000fd5b505050506040513d601f19601f82011682018060405250810190610a0e9190610d48565b9050610a1981610245565b858481518110610a3957634e487b7160e01b600052603260045260246000fd5b6020908102919091010152610a516001821b85610e4f565b935083811c91505b82610a6381610ec2565b9350505b60018216610b6157600085610a7d600186610eab565b81518110610a9b57634e487b7160e01b600052603260045260246000fd5b60200260200101519050600086600286610ab59190610eab565b81518110610ad357634e487b7160e01b600052603260045260246000fd5b602002602001015190508082604051602001610af9929190918252602082015260400190565b6040516020818303038152906040528051906020012087600287610b1d9190610eab565b81518110610b3b57634e487b7160e01b600052603260045260246000fd5b6020908102919091010152610b51600186610eab565b9450600184901c93505050610a67565b61092c565b82600114610ba45760405162461bcd60e51b815260206004820152600b60248201526a39ba30b1b59032b93937b960a91b604482015260640161012d565b84600081518110610bc557634e487b7160e01b600052603260045260246000fd5b60200260200101519750505050505050509392505050565b60006020808385031215610bef578182fd5b823567ffffffffffffffff80821115610c06578384fd5b818501915085601f830112610c19578384fd5b813581811115610c2b57610c2b610ef3565b8060051b604051601f19603f83011681018181108582111715610c5057610c50610ef3565b604052828152858101935084860182860187018a1015610c6e578788fd5b8795505b83861015610c90578035855260019590950194938601938601610c72565b5098975050505050505050565b600060208284031215610cae578081fd5b8151801515811461023e578182fd5b600080600060408486031215610cd1578182fd5b833567ffffffffffffffff80821115610ce8578384fd5b818601915086601f830112610cfb578384fd5b813581811115610d09578485fd5b876020828501011115610d1a578485fd5b6020928301989097509590910135949350505050565b600060208284031215610d41578081fd5b5035919050565b600060208284031215610d59578081fd5b5051919050565b60008060008060008060a08789031215610d78578182fd5b86359550602087013594506040870135935060608701359250608087013567ffffffffffffffff80821115610dab578384fd5b818901915089601f830112610dbe578384fd5b813581811115610dcc578485fd5b8a60208260051b8501011115610de0578485fd5b6020830194508093505050509295509295509295565b600060208284031215610e07578081fd5b815160ff8116811461023e578182fd5b8183823760009101908152919050565b60008085851115610e36578182fd5b83861115610e42578182fd5b5050820193919092039150565b60008219821115610e6257610e62610edd565b500190565b600060ff821660ff84168060ff03821115610e8457610e84610edd565b019392505050565b6000816000190483118215151615610ea657610ea6610edd565b500290565b600082821015610ebd57610ebd610edd565b500390565b6000600019821415610ed657610ed6610edd565b5060010190565b634e487b7160e01b600052601160045260246000fd5b634e487b7160e01b600052604160045260246000fdfe011b4d03dd8c01f1049143cf9c4c817e4b167f1d1b83e5c6f0f10d89ba1e7bce4d9470a821fbe90117ec357e30bad9305732fb19ddf54a07dd3e29f440619254ae39ce8537aca75e2eff3e38c98011dfe934e700a0967732fc07b430dd656a233fc9a15f5b4869c872f81087bb6104b7d63e6f9ab47f2c43f3535eae7172aa7f17d2dd614cddaa4d879276b11e0672c9560033d3e8453a1d045339d34ba601b9c37b8b13ca95166fb7af16988a70fcc90f38bf9126fd833da710a47fb37a55e68e7a427fa943d9966b389f4f257173676090c6e95f43e2cb6d65f8758111e30930b0b9deb73e155c59740bacf14a6ff04b64bb8e201a506409c3fe381ca4ea90cd5deac729d0fdaccc441d09d7325f41586ba13c801b7eccae0f95d8f3933efed8b96e5b7f6f459e9cb6a2f41bf276c7b85c10cd4662c04cbbb365434726c0a0c9695393027fb106a8153109ac516288a88b28a93817899460d6310b71cf1e6163e8806fa0d4b197a259e8c3ac28864268159d0ac85f8581ca28fa7d2c0c03eb91e3eee5ca7a3da2b3053c9770db73599fb149f620e3facef95e947c0ee860b72122e31e4bbd2b7c783d79cc30f60c6238651da7f0726f767d22747264fdb046f7549f26cc70ed5e18baeb6c81bb0625cb95bb4019aeecd40774ee87ae29ec517a71f6ee264c5d761379b3d7d617ca83677374b49d10aec50505ac087408ca892b573c267a712a52e1d06421fe276a03efb1889f337201110fdc32a81f8e152499af665835aabfdc6740c7e2c3791a31c3cdc9f5ab962f681b12fc092816a62f27d86025599a41233848702f0cfc0437b445682df51147a632a0a083d2d38b5e13e466a8935afff58bb533b3ef5d27fba63ee6b0fd9e67ff20af9d50deee3f8bf065ec220c1fd4ba57e341261d55997f85d66d32152526736872693d2b437a233e2337b715f6ac9a6a272622fdc2d67fcfe1da3459f8dab4ed7e40a657a54c36766c5e8ac9a88b35b05c34747e6507f6b044ab66180dc76ac1a696de03189593fedc0d0dbbd855c8ead673544899b0960e4a5a7ca43b4ef90afe607de7698caefdc242788f654b57a4fb32a71b335ef6ff9a4cc118b282b53bdd6d6192b7a82c3c5126b9c7e33c8e5a5ac9738b8bd31247fb7402054f97b573e8abb9faad219f4fd085aceaa7f542d787ee4196d365f3cc566e7bbcfbfd451230c48d804c017d21e2d8fa914e2559bb72bf0ab78c8ab92f00ef0d0d576eccdd486b64138a4172674857e543d1d5b639058dd908186597e366ad5f3d9c7ceaff44d04d1550b8d33abc751df07437834ba5acb32328a396994aebb3c40f759c2d6d7a3cb5377e55d5d218ef5a296dda8ddc355f3f50c3d0b660a51dfa4d98a6a5a33564556cf83c1373a814641d6a1dcef97b883fee61bb84fe60a3409340217e629cc7e4dcc93b85d8820921ff5826148b60e6939acd7838e1d7f20562bff8ee4b5ec4a05ad997a57b9796fdcb2eda87883c2640b072b140b946bfdf6575cacc066fdae04f6951e63624cbd316a677cad529bbe4e97b9144e4bc06c4afd1de55dd3e1175f90423847a230d34dfb71ed56f2965a7f6c72e6aa33c24c303fd67745d632656c5ef90bec80f4f5d1daa251988826cef375c81c36bf457e09687056f924677cb0bccf98dff81e014ce25f2d132497923e267363963cdf4302c5049d63131dc03fd95f65d8b6aa5934f817252c028c90f56d413b9d5d10d89790707dae2fabb249f649929927c21dd71e3f656826de5451c5da375aadecbd59d5ebf3a31fae65ac1b316a1611f1b276b26530f58d7247df459ce1f86db1d734f6f811932f042cee45d0e455306d01081bc3384f82c5fb2aacaa19d89cdfa46cc916eac61121475ba2e6191b4feecbe1789717021a158ace5d06744b40f551076b67cd63af60007f8c99876e1424883a45ec49d497ddaf808a5521ca74a999ab0b3c7aa9c80f85e93977ec61ce68b20307a1a81f71ca645b568fcd319ccbb5f651e87b707d37c39e15f945ea69e2f7c7d2ccc85b7e654c07e96f0636ae4044fe0e38590b431795ad0f8647bdd613713ada493cc17efd313206380e6a685b8198475bbd021c6e9d94daab2214947127506073e44d5408ba166c512a0b86805d07f5a44d3c41706be2bc15e712e55805248b92e8677d90f6d284d1d6ffaff2c430657042a0e82624fa3717b06cc0a6fd12230ea586dae83019fb9e06034ed2803c98d554b93c9a52348cafff75c40174a91f9ae6b8647854a156029f0b88b83316663ce574a4978277bb6bb27a31085634b6ec78864b6d8201c7e93903d75815067e378289a3d072ae172dafa6a452470f8d645bebfad9779594fc0784bb764a22e3a8181d93db7bf97893c414217a618ccb14caa9e92e8c61673afc9583662e812adba1f87a9c68202d60e909efab43c42c0cb00695fc7f1ffe67c75ca894c3c51e1e5e731360199e600f6ced9a87b2a6a87e70bf251bb5075ab222138288164b2eda727515ea7de12e2496d4fe42ea8d1a120c03cf9c50622c2afe4acb0dad98fd62d07ab4e828a94495f6d1ab973982c7ccbe6c1fae02788e4422ae22282fa49cbdb04ba54a7a238c6fc41187451383460762c06d1c8a72b9cd718866ad4b689e10c9a8c38fe5ef045bd785b01e980fc82c7e3532ce81876b778dd9f1ceeba4478e86411fb6fdd790683916ca832592485093644e8760cd7b4c01dba1ccc82b661bf13f0e3f34acd6b88a2646970667358221220be79c972192069d105a5fc9aae66c9ff55a7f4076d708aa33a4f2ecaec2873e364736f6c63430008040033",
  "deployedBytecode": "0x73000000000000000000000000000000000000000030146080604052600436106100615760003560e01c806334bd712d14610066578063451a10551461008b57806379de46011461009e57806382b0eab8146100b1578063c84583a1146100c4575b600080fd5b610079610074366004610cbd565b6100d7565b60405190815260200160405180910390f35b610079610099366004610d30565b610245565b6100796100ac366004610d60565b6102d6565b6100796100bf366004610bdd565b610505565b6100796100d2366004610cbd565b610756565b6000600382901b816100ea600883610e4f565b9050848211156101365760405162461bcd60e51b8152602060048201526012602482015271776f7264206f7574206f6620626f756e647360701b60448201526064015b60405180910390fd5b8481116101795761014981838789610e27565b60405160200161015a929190610e17565b604051602081830303815290604052805190602001209250505061023e565b60408051600880825281830190925260009160208201818036833701905050905060006101a68488610eab565b905060005b8181101561022f5788886101bf8388610e4f565b8181106101dc57634e487b7160e01b600052603260045260246000fd5b9050013560f81c60f81b83828151811061020657634e487b7160e01b600052603260045260246000fd5b60200101906001600160f81b031916908160001a9053508061022781610ec2565b9150506101ab565b50508051602090910120925050505b9392505050565b600080610253836020610e8c565b9050610260816020610e4f565b6107a010156102a75760405162461bcd60e51b8152602060048201526013602482015272696e646578206f7574206f6620626f756e647360681b604482015260640161012d565b600080604051806107c001604052806107a08152602001610f0a6107a091399290920160200151949350505050565b60008585101580156102e9575060038610155b80156102f6575060408511155b6103605760405162461bcd60e51b815260206004820152603560248201527f33203c3d206c6f6753697a654f665265706c6163656d656e74203c3d206c6f6760448201527414da5e9953d9919d5b1b111c9a5d99480f0f480d8d605a1b606482015260840161012d565b600180871b9088906103729083610eab565b16156103c05760405162461bcd60e51b815260206004820152601760248201527f506f736974696f6e206973206e6f7420616c69676e6564000000000000000000604482015260640161012d565b6103ca8787610eab565b83146104185760405162461bcd60e51b815260206004820152601b60248201527f50726f6f66206c656e67746820646f6573206e6f74206d617463680000000000604482015260640161012d565b60005b838110156104f85781811b891661048b578585858381811061044d57634e487b7160e01b600052603260045260246000fd5b9050602002013560405160200161046e929190918252602082015260400190565b6040516020818303038152906040528051906020012095506104e6565b8484828181106104ab57634e487b7160e01b600052603260045260246000fd5b90506020020135866040516020016104cd929190918252602082015260400190565b6040516020818303038152906040528051906020012095505b806104f081610ec2565b91505061041b565b5093979650505050505050565b805160405163d82ae4b160e01b815260009173__$8b7ebe2a69e01741840a6648963dfd5409$__9163d82ae4b1916105439160040190815260200190565b60206040518083038186803b15801561055b57600080fd5b505af415801561056f573d6000803e3d6000fd5b505050506040513d601f19601f820116820180604052508101906105939190610c9d565b6105df5760405162461bcd60e51b815260206004820152601860248201527f6172726179206c656e206e6f7420706f776572206f6620320000000000000000604482015260640161012d565b815160011415610619578160008151811061060a57634e487b7160e01b600052603260045260246000fd5b60200260200101519050919050565b600060018351901c67ffffffffffffffff81111561064757634e487b7160e01b600052604160045260246000fd5b604051908082528060200260200182016040528015610670578160200160208202803683370190505b50905060005b835181101561074c5783818151811061069f57634e487b7160e01b600052603260045260246000fd5b6020026020010151848260016106b59190610e4f565b815181106106d357634e487b7160e01b600052603260045260246000fd5b60200260200101516040516020016106f5929190918252602082015260400190565b6040516020818303038152906040528051906020012082600183901c8151811061072f57634e487b7160e01b600052603260045260246000fd5b6020908102919091010152610745600282610e4f565b9050610676565b5061023e81610505565b60006003821015801561076a575060408211155b6107b65760405162461bcd60e51b815260206004820152601960248201527f72616e6765206f66206c6f673253697a653a205b332c36345d00000000000000604482015260640161012d565b826107d0576107c9610099600384610eab565b905061023e565b60006107dd600384610eab565b6001901b9050600381901b8411156108375760405162461bcd60e51b815260206004820152601960248201527f6461746120697320626967676572207468616e20647269766500000000000000604482015260640161012d565b6040516306c8e54b60e01b8152600385901c600482015260009073__$8b7ebe2a69e01741840a6648963dfd5409$__906306c8e54b9060240160206040518083038186803b15801561088857600080fd5b505af415801561089c573d6000803e3d6000fd5b505050506040513d601f19601f820116820180604052508101906108c09190610df6565b6108cb906002610e67565b60ff16905060008167ffffffffffffffff8111156108f957634e487b7160e01b600052604160045260246000fd5b604051908082528060200260200182016040528015610922578160200160208202803683370190505b5090506000806000805b86841015610b6657600384901b8a111561098b5761094b8b8b866100d7565b85848151811061096b57634e487b7160e01b600052603260045260246000fd5b60209081029190910101528361098081610ec2565b945050839150610a59565b60405163052dcf5f60e31b81526004810185905273__$8b7ebe2a69e01741840a6648963dfd5409$__9063296e7af89060240160206040518083038186803b1580156109d657600080fd5b505af41580156109ea573d6000803e3d6000fd5b505050506040513d601f19601f82011682018060405250810190610a0e9190610d48565b9050610a1981610245565b858481518110610a3957634e487b7160e01b600052603260045260246000fd5b6020908102919091010152610a516001821b85610e4f565b935083811c91505b82610a6381610ec2565b9350505b60018216610b6157600085610a7d600186610eab565b81518110610a9b57634e487b7160e01b600052603260045260246000fd5b60200260200101519050600086600286610ab59190610eab565b81518110610ad357634e487b7160e01b600052603260045260246000fd5b602002602001015190508082604051602001610af9929190918252602082015260400190565b6040516020818303038152906040528051906020012087600287610b1d9190610eab565b81518110610b3b57634e487b7160e01b600052603260045260246000fd5b6020908102919091010152610b51600186610eab565b9450600184901c93505050610a67565b61092c565b82600114610ba45760405162461bcd60e51b815260206004820152600b60248201526a39ba30b1b59032b93937b960a91b604482015260640161012d565b84600081518110610bc557634e487b7160e01b600052603260045260246000fd5b60200260200101519750505050505050509392505050565b60006020808385031215610bef578182fd5b823567ffffffffffffffff80821115610c06578384fd5b818501915085601f830112610c19578384fd5b813581811115610c2b57610c2b610ef3565b8060051b604051601f19603f83011681018181108582111715610c5057610c50610ef3565b604052828152858101935084860182860187018a1015610c6e578788fd5b8795505b83861015610c90578035855260019590950194938601938601610c72565b5098975050505050505050565b600060208284031215610cae578081fd5b8151801515811461023e578182fd5b600080600060408486031215610cd1578182fd5b833567ffffffffffffffff80821115610ce8578384fd5b818601915086601f830112610cfb578384fd5b813581811115610d09578485fd5b876020828501011115610d1a578485fd5b6020928301989097509590910135949350505050565b600060208284031215610d41578081fd5b5035919050565b600060208284031215610d59578081fd5b5051919050565b60008060008060008060a08789031215610d78578182fd5b86359550602087013594506040870135935060608701359250608087013567ffffffffffffffff80821115610dab578384fd5b818901915089601f830112610dbe578384fd5b813581811115610dcc578485fd5b8a60208260051b8501011115610de0578485fd5b6020830194508093505050509295509295509295565b600060208284031215610e07578081fd5b815160ff8116811461023e578182fd5b8183823760009101908152919050565b60008085851115610e36578182fd5b83861115610e42578182fd5b5050820193919092039150565b60008219821115610e6257610e62610edd565b500190565b600060ff821660ff84168060ff03821115610e8457610e84610edd565b019392505050565b6000816000190483118215151615610ea657610ea6610edd565b500290565b600082821015610ebd57610ebd610edd565b500390565b6000600019821415610ed657610ed6610edd565b5060010190565b634e487b7160e01b600052601160045260246000fd5b634e487b7160e01b600052604160045260246000fdfe011b4d03dd8c01f1049143cf9c4c817e4b167f1d1b83e5c6f0f10d89ba1e7bce4d9470a821fbe90117ec357e30bad9305732fb19ddf54a07dd3e29f440619254ae39ce8537aca75e2eff3e38c98011dfe934e700a0967732fc07b430dd656a233fc9a15f5b4869c872f81087bb6104b7d63e6f9ab47f2c43f3535eae7172aa7f17d2dd614cddaa4d879276b11e0672c9560033d3e8453a1d045339d34ba601b9c37b8b13ca95166fb7af16988a70fcc90f38bf9126fd833da710a47fb37a55e68e7a427fa943d9966b389f4f257173676090c6e95f43e2cb6d65f8758111e30930b0b9deb73e155c59740bacf14a6ff04b64bb8e201a506409c3fe381ca4ea90cd5deac729d0fdaccc441d09d7325f41586ba13c801b7eccae0f95d8f3933efed8b96e5b7f6f459e9cb6a2f41bf276c7b85c10cd4662c04cbbb365434726c0a0c9695393027fb106a8153109ac516288a88b28a93817899460d6310b71cf1e6163e8806fa0d4b197a259e8c3ac28864268159d0ac85f8581ca28fa7d2c0c03eb91e3eee5ca7a3da2b3053c9770db73599fb149f620e3facef95e947c0ee860b72122e31e4bbd2b7c783d79cc30f60c6238651da7f0726f767d22747264fdb046f7549f26cc70ed5e18baeb6c81bb0625cb95bb4019aeecd40774ee87ae29ec517a71f6ee264c5d761379b3d7d617ca83677374b49d10aec50505ac087408ca892b573c267a712a52e1d06421fe276a03efb1889f337201110fdc32a81f8e152499af665835aabfdc6740c7e2c3791a31c3cdc9f5ab962f681b12fc092816a62f27d86025599a41233848702f0cfc0437b445682df51147a632a0a083d2d38b5e13e466a8935afff58bb533b3ef5d27fba63ee6b0fd9e67ff20af9d50deee3f8bf065ec220c1fd4ba57e341261d55997f85d66d32152526736872693d2b437a233e2337b715f6ac9a6a272622fdc2d67fcfe1da3459f8dab4ed7e40a657a54c36766c5e8ac9a88b35b05c34747e6507f6b044ab66180dc76ac1a696de03189593fedc0d0dbbd855c8ead673544899b0960e4a5a7ca43b4ef90afe607de7698caefdc242788f654b57a4fb32a71b335ef6ff9a4cc118b282b53bdd6d6192b7a82c3c5126b9c7e33c8e5a5ac9738b8bd31247fb7402054f97b573e8abb9faad219f4fd085aceaa7f542d787ee4196d365f3cc566e7bbcfbfd451230c48d804c017d21e2d8fa914e2559bb72bf0ab78c8ab92f00ef0d0d576eccdd486b64138a4172674857e543d1d5b639058dd908186597e366ad5f3d9c7ceaff44d04d1550b8d33abc751df07437834ba5acb32328a396994aebb3c40f759c2d6d7a3cb5377e55d5d218ef5a296dda8ddc355f3f50c3d0b660a51dfa4d98a6a5a33564556cf83c1373a814641d6a1dcef97b883fee61bb84fe60a3409340217e629cc7e4dcc93b85d8820921ff5826148b60e6939acd7838e1d7f20562bff8ee4b5ec4a05ad997a57b9796fdcb2eda87883c2640b072b140b946bfdf6575cacc066fdae04f6951e63624cbd316a677cad529bbe4e97b9144e4bc06c4afd1de55dd3e1175f90423847a230d34dfb71ed56f2965a7f6c72e6aa33c24c303fd67745d632656c5ef90bec80f4f5d1daa251988826cef375c81c36bf457e09687056f924677cb0bccf98dff81e014ce25f2d132497923e267363963cdf4302c5049d63131dc03fd95f65d8b6aa5934f817252c028c90f56d413b9d5d10d89790707dae2fabb249f649929927c21dd71e3f656826de5451c5da375aadecbd59d5ebf3a31fae65ac1b316a1611f1b276b26530f58d7247df459ce1f86db1d734f6f811932f042cee45d0e455306d01081bc3384f82c5fb2aacaa19d89cdfa46cc916eac61121475ba2e6191b4feecbe1789717021a158ace5d06744b40f551076b67cd63af60007f8c99876e1424883a45ec49d497ddaf808a5521ca74a999ab0b3c7aa9c80f85e93977ec61ce68b20307a1a81f71ca645b568fcd319ccbb5f651e87b707d37c39e15f945ea69e2f7c7d2ccc85b7e654c07e96f0636ae4044fe0e38590b431795ad0f8647bdd613713ada493cc17efd313206380e6a685b8198475bbd021c6e9d94daab2214947127506073e44d5408ba166c512a0b86805d07f5a44d3c41706be2bc15e712e55805248b92e8677d90f6d284d1d6ffaff2c430657042a0e82624fa3717b06cc0a6fd12230ea586dae83019fb9e06034ed2803c98d554b93c9a52348cafff75c40174a91f9ae6b8647854a156029f0b88b83316663ce574a4978277bb6bb27a31085634b6ec78864b6d8201c7e93903d75815067e378289a3d072ae172dafa6a452470f8d645bebfad9779594fc0784bb764a22e3a8181d93db7bf97893c414217a618ccb14caa9e92e8c61673afc9583662e812adba1f87a9c68202d60e909efab43c42c0cb00695fc7f1ffe67c75ca894c3c51e1e5e731360199e600f6ced9a87b2a6a87e70bf251bb5075ab222138288164b2eda727515ea7de12e2496d4fe42ea8d1a120c03cf9c50622c2afe4acb0dad98fd62d07ab4e828a94495f6d1ab973982c7ccbe6c1fae02788e4422ae22282fa49cbdb04ba54a7a238c6fc41187451383460762c06d1c8a72b9cd718866ad4b689e10c9a8c38fe5ef045bd785b01e980fc82c7e3532ce81876b778dd9f1ceeba4478e86411fb6fdd790683916ca832592485093644e8760cd7b4c01dba1ccc82b661bf13f0e3f34acd6b88a2646970667358221220be79c972192069d105a5fc9aae66c9ff55a7f4076d708aa33a4f2ecaec2873e364736f6c63430008040033",
  "libraries": {
    "CartesiMath": "0x9fE46736679d2D9a65F0992F2272dE9f3c7fa6e0"
  },
  "devdoc": {
    "kind": "dev",
    "methods": {
      "calculateRootFromPowerOfTwo(bytes32[])": {
        "params": {
          "hashes": "The array containing power of 2 elements"
        },
        "returns": {
          "_0": "byte32 the root hash being calculated"
        }
      },
      "getEmptyTreeHashAtIndex(uint256)": {
        "details": "first index is keccak(0), second index is keccak(keccak(0), keccak(0))",
        "params": {
          "_index": "of hash wanted"
        }
      },
      "getHashOfWordAtIndex(bytes,uint256)": {
        "details": "if word is incomplete (< 8 bytes) it gets padded with zeroes",
        "params": {
          "_data": "array of bytes",
          "_wordIndex": "index of word inside the bytes to get the hash of"
        }
      },
      "getMerkleRootFromBytes(bytes,uint256)": {
        "details": "_data is padded with zeroes until is multiple of 8root is completed with zero tree until log2size is completehashes are taken word by word (8 bytes by 8 bytes)",
        "params": {
          "_data": "array of bytes to be merklelized",
          "_log2Size": "log2 of total size of the drive"
        }
      },
      "getRootAfterReplacementInDrive(uint256,uint256,uint256,bytes32,bytes32[])": {
        "params": {
          "_logSizeOfFullDrive": "log2 of size the full drive, which can be the entire machine",
          "_logSizeOfReplacement": "log2 of size the replacement",
          "_position": "position of _drive",
          "_replacement": "hash of the replacement",
          "siblings": "of replacement that merkle root can be calculated"
        }
      }
    },
    "version": 1
  },
  "userdoc": {
    "kind": "user",
    "methods": {
      "calculateRootFromPowerOfTwo(bytes32[])": {
        "notice": "Calculate the root of Merkle tree from an array of power of 2 elements"
      },
      "getEmptyTreeHashAtIndex(uint256)": {
        "notice": "Gets precomputed hash of zero in empty tree hashes"
      },
      "getHashOfWordAtIndex(bytes,uint256)": {
        "notice": "Get the hash of a word in an array of bytes"
      },
      "getMerkleRootFromBytes(bytes,uint256)": {
        "notice": "get merkle root of generic array of bytes"
      },
      "getRootAfterReplacementInDrive(uint256,uint256,uint256,bytes32,bytes32[])": {
        "notice": "Gets merkle root hash of drive with a replacement"
      }
    },
    "version": 1
  },
  "storageLayout": {
    "storage": [],
    "types": null
  }
}